<?xml version="1.0" encoding="UTF-8" standalone="no" ?>
<RiskProfileTree xmlns="http://example.com/inherent" xmlns:xsi="http://www.w3.org/2001/XMLSchema-instance" xsi:schemaLocation="http://example.com/inherent ../xsd/InherentRiskProfile.xsd">
  <RiskProfileNode>
    <Profile_ID>RI0700100000</Profile_ID>
    <risiko_name>Risiko Stratejik</risiko_name>
    <assessment_factor>Kesesuaian Strategi dengan Kondisi Lingkungan Bisnis</assessment_factor>
    <weight>25</weight>
    <ID>1297</ID>
    <Risk_ID>14</Risk_ID>
    <threshold>5 : Score&lt;=36,
4:  36 &lt; Score &lt;=52
3:  52 &lt; Score &lt;=68
2:  68 &lt; Score &lt;=84
1:  84 &lt; Score &lt;=100</threshold>
    <rating_to_score/>
    <RiskProfileNode>
      <Profile_ID>RI0700100107</Profile_ID>
      <risiko_name>Risiko Stratejik</risiko_name>
      <assessment_factor>1.1.4.3 Pembiayaan - Gearing Ratio</assessment_factor>
      <weight>1.14</weight>
      <ID>1305</ID>
      <Risk_ID>14</Risk_ID>
      <threshold>1. Gearing Ratio &lt; 10 Kali
 2. 10 ≤ Gearing Ratio &lt; 11 Kali
 3. 11 ≤ Gearing Ratio &lt; 12 Kali
 4. 12 ≤ Gearing Ratio &lt; 13 Kali
 5. Gearing Ratio ≥ 13 kali</threshold>
      <rating_to_score/>
    </RiskProfileNode>
    <RiskProfileNode>
      <Profile_ID>RI0700100108</Profile_ID>
      <risiko_name>Risiko Stratejik</risiko_name>
      <assessment_factor>1.1.4.4 Modal Kerja Bersih Disesuaikan (MKBD) Sekuritas</assessment_factor>
      <weight>1.14</weight>
      <ID>1306</ID>
      <Risk_ID>14</Risk_ID>
      <threshold>1. MKBD ≥ 450 Miliar
 2. 449 Miliar ≤ MKBD &lt; 350 Miliar
 3. 349 Miliar % ≤ MKBD &lt; 250 Miliar
 4. 249 Miliar ≤ MKBD &lt; 150 Miliar
 5. MKBD &lt; 149 Miliar</threshold>
      <rating_to_score/>
    </RiskProfileNode>
    <RiskProfileNode>
      <Profile_ID>RI0700100109</Profile_ID>
      <risiko_name>Risiko Stratejik</risiko_name>
      <assessment_factor>1.1.4.5 Modal Kerja Bersih Disesuaikan (MKBD) Asset Management</assessment_factor>
      <weight>1.15</weight>
      <ID>1307</ID>
      <Risk_ID>14</Risk_ID>
      <threshold>1. MKBD ≥ 250 Miliar
 2. 249 Miliar ≤ MKBD &lt; 200 Miliar
 3. 199 Miliar % ≤ MKBD &lt; 150 Miliar
 4. 149 Miliar ≤ MKBD &lt; 100 Miliar
 5. MKBD &lt; 99 Miliar</threshold>
      <rating_to_score/>
    </RiskProfileNode>
    <RiskProfileNode>
      <Profile_ID>RI0700100200</Profile_ID>
      <risiko_name>Risiko Stratejik</risiko_name>
      <assessment_factor>1.2 Faktor eksternal, antara lain:</assessment_factor>
      <weight>12</weight>
      <ID>1308</ID>
      <Risk_ID>14</Risk_ID>
      <threshold/>
      <rating_to_score/>
    </RiskProfileNode>
    <RiskProfileNode>
      <Profile_ID>RI0700100101</Profile_ID>
      <risiko_name>Risiko Stratejik</risiko_name>
      <assessment_factor>1.1.1 Visi, misi, dan arah bisnis yang ingin dicapai oleh LJK</assessment_factor>
      <weight>11.1</weight>
      <ID>1299</ID>
      <Risk_ID>14</Risk_ID>
      <threshold>1. Strategi LJK sudah sangat sesuai dengan Visi, Misi dan Arah Bisnis yang ingin dicapai LJK (konsisten dilaksanakan tepat waktu)
 2. Strategi LJK sudah sesuai dengan Visi, Misi dan Arah Bisnisi yang ingin dicapai LJK, (bertahap dilaksanakan)
 3. Strategi LJK Cukup sesuai dengan Visi, Misi dan Arah Bisnis yang ingin dicapai LJK, (dijalankan perlahan dan masih terdapat kekurangan)
 4. Strategi LJK kurang sesuai dengan Visi, Misi dan Arah Bisnis yang ingin dicapai LJK (terdapat beberapa yang dijalankan tidak sesuai visi dan misi LJK)
 5. Strategi LJK tidak sesuai dengan Visi, Misi dan Arah Bisnis yang ingin dicapai Bank (dijalankan sangat tidak sesuai dengan visi misi LJK)</threshold>
      <rating_to_score/>
    </RiskProfileNode>
    <RiskProfileNode>
      <Profile_ID>RI0700100202</Profile_ID>
      <risiko_name>Risiko Stratejik</risiko_name>
      <assessment_factor>1.2.2 Tingkat persaingan usaha.</assessment_factor>
      <weight>1.22</weight>
      <ID>1310</ID>
      <Risk_ID>14</Risk_ID>
      <threshold>1: Bidang Usaha yang dimiliki oleh Konglomerasi Keuangan Sinar Mas sangat variatif
 2: Bidang Usaha yang dimiliki oleh Konglomerasi Keuangan Sinar Mas variatif
 3: Bidang Usaha yang dimiliki oleh Konglomerasi Keuangan Sinar Mas cukup variatif
 4: Bidang Usaha yang dimiliki oleh Konglomerasi Keuangan Sinar Mas kurang variatif
 5: Bidang Usaha yang dimiliki oleh Konglomerasi Keuangan Sinar Mas tidak variatif</threshold>
      <rating_to_score/>
    </RiskProfileNode>
    <RiskProfileNode>
      <Profile_ID>RI0700100100</Profile_ID>
      <risiko_name>Risiko Stratejik</risiko_name>
      <assessment_factor>1.1 Faktor internal, antara lain:</assessment_factor>
      <weight>11</weight>
      <ID>1298</ID>
      <Risk_ID>14</Risk_ID>
      <threshold/>
      <rating_to_score/>
    </RiskProfileNode>
    <RiskProfileNode>
      <Profile_ID>RI0700100201</Profile_ID>
      <risiko_name>Risiko Stratejik</risiko_name>
      <assessment_factor>1.2.1 Perkembangan teknologI

(Dampak Perkembangan Teknologi yang diserap oleh LJK)</assessment_factor>
      <weight>1.21</weight>
      <ID>1309</ID>
      <Risk_ID>14</Risk_ID>
      <threshold>1. Rata-rata (&gt;50%) LJK Memiliki Sistem Informasi Teknologi yang sangat terupdate sesuai perkembangan yang ada saat ini
 2.Rata-rata (&gt;50%) memiliki sistem informasi teknologi yang bertahap terkini/terupdate sesuai perkembangan yang ada saat ini
 3. Rata-rata (&gt;50%) LJK memiliki sistem informasi teknologi yang cukup terkini update sesuai perkembangan yang ada saat ini
 4. Rata-rata (&gt;50%) LJK memiliki sistem informasi teknologi yang kurang terkini/update sesuai perkembangan yang ada saat ini
 5. Rata-rata (&gt;50%) LJK memiliki sistem informasi teknologi yang ketingggalan jauh/tidak terupdate sesuai perkembangan yang ada saat ini</threshold>
      <rating_to_score/>
    </RiskProfileNode>
    <RiskProfileNode>
      <Profile_ID>RI0700100102</Profile_ID>
      <risiko_name>Risiko Stratejik</risiko_name>
      <assessment_factor>1.1.2 Kultur organisasi, terutama jika penetapan tujuan stratejik mensyaratkan perubahan struktur organisasi dan penyesuaian proses bisnis;</assessment_factor>
      <weight>11.2</weight>
      <ID>1300</ID>
      <Risk_ID>14</Risk_ID>
      <threshold>1. Rata-rata (&gt;50%) LJK terdapat perubahan struktur organisasi perseroan lebih dari 2 kali dalam 1 tahun terakhir.
 2. Rata-rata (&gt;50%) Terdapat perubahan struktur organisasi perseroan sebanyak 1 kali dalam 1 tahun terakhir.
 3. Rata-rata (&gt;50%) tidak terdapat perubahan struktur organisasi perseroan dalam 2 tahun terakhir atau Rata-rata (&gt;50%) terdapat perubahan struktur 4 kali dalam 1 tahun terakhir.
 4. Rata-rata (&gt;50%) tidak terdapat perubahan struktur organisasi perseroan selama lebih dari 3 tahun atau Rata-rata (&gt;50%) terdapat perubahan struktur lebih dari 5 kali dalam 1 tahun terakhir.
 5. Rata-rata (&gt;50%) tidak terdapat perubahan struktur organisasi perseroan selama lebih dari 4 tahun atau Rata-rata (&gt;50%) terdapat perubahan struktur lebih dari 6 kali dalam 1 tahun terakhir.</threshold>
      <rating_to_score/>
    </RiskProfileNode>
    <RiskProfileNode>
      <Profile_ID>RI0700100103</Profile_ID>
      <risiko_name>Risiko Stratejik</risiko_name>
      <assessment_factor>1.1.3 Faktor kemampuan organisasi yang mencakup antara lain sumber daya manusia, infrastruktur, dan sistem informasi manajemen;</assessment_factor>
      <weight>11.3</weight>
      <ID>1301</ID>
      <Risk_ID>14</Risk_ID>
      <threshold>1. Kemampuan organisasi LJK (SDM, Infrastruktur, teknologi) sangat memadai (rata-rata (&gt;50%) terdapat perkembangan baru dalam 1 semester terakhir).
 2. Kemampuan organisasi LJK (SDM, Infrastruktur, teknologi) memadai ( rata-rata LJK terdapat perkembangan baru dalam 1 tahun terakhir)
 3. Kemampuan organisasi LJK (SDM, Infrastruktur, teknologi) cukup memadai (rata-rata LJK baru terdapat perkembangan baru dalam periode 1,5 tahun terakhir) 
 4. Kemampuan organisasi bank (SDM, Infrastruktur, teknologi) kurang memadai (rata-rata tidak terdapat perkembangan baru dalam 2 tahun terakhir)
 5. Kemampuan organisasi bank (SDM, Infrastruktur, teknologi) tidak memadai (rata-rata tidak terdapat perkembangan baru lebih dari 2 tahun terakhir)</threshold>
      <rating_to_score/>
    </RiskProfileNode>
    <RiskProfileNode>
      <Profile_ID>RI0700100104</Profile_ID>
      <risiko_name>Risiko Stratejik</risiko_name>
      <assessment_factor>1.1.4 Tingkat toleransi Risiko yaitu tingkat kemampuan keuangan LJK menyerap Risiko; dan</assessment_factor>
      <weight>11.4</weight>
      <ID>1302</ID>
      <Risk_ID>14</Risk_ID>
      <threshold/>
      <rating_to_score/>
    </RiskProfileNode>
    <RiskProfileNode>
      <Profile_ID>RI0700100105</Profile_ID>
      <risiko_name>Risiko Stratejik</risiko_name>
      <assessment_factor>1.1.4.1 Bank - Rasio Capital Adequancy Ratio (CAR)</assessment_factor>
      <weight>1.14</weight>
      <ID>1303</ID>
      <Risk_ID>14</Risk_ID>
      <threshold>1. CAR ≥14 %
 2. 11% ≤ CAR &lt; 14%
 3. 10% ≤ CAR &lt; 11%
 4. 8% ≤ CAR &lt; 10%
 5. CAR &lt;8%</threshold>
      <rating_to_score/>
    </RiskProfileNode>
    <RiskProfileNode>
      <Profile_ID>RI0700100106</Profile_ID>
      <risiko_name>Risiko Stratejik</risiko_name>
      <assessment_factor>1.1.4.2 Asuransi - Risk Based Capital (RBC)</assessment_factor>
      <weight>1.14</weight>
      <ID>1304</ID>
      <Risk_ID>14</Risk_ID>
      <threshold>1. RBC ≥ 120%
 2. 110% ≤ RBC &lt; 120%
 3. 100% ≤ RBC &lt; 110%
 4. 90% ≤ RBC &lt; 100%
 5. RBC ≤ 90%</threshold>
      <rating_to_score/>
    </RiskProfileNode>
  </RiskProfileNode>
  <RiskProfileNode>
    <Profile_ID>RI0300400000</Profile_ID>
    <risiko_name>Risiko Likuiditas</risiko_name>
    <assessment_factor>Akses pada Sumber-Sumber Pendanaan</assessment_factor>
    <weight>1</weight>
    <ID>1156</ID>
    <Risk_ID>10</Risk_ID>
    <threshold>5 : Score&lt;=36,
4:  36 &lt; Score &lt;=52
3:  52 &lt; Score &lt;=68
2:  68 &lt; Score &lt;=84